 1   0.000000 192.168.10.101 → 192.168.10.255 BROWSER 243 Local Master Announcement SKYNET, Workstation, Server, Domain Controller, Time Source, NT Workstation, Master Browser, DFS server
    2   2.689821 Vmware_bf:da:e5 → Broadcast    ARP 60 Who has 192.168.10.101? Tell 192.168.10.127
    3   2.690046 Vmware_28:c0:55 → Vmware_bf:da:e5 ARP 60 192.168.10.101 is at 00:0c:29:28:c0:55
    4   2.690156 192.168.10.127 → 192.168.10.101 ICMP 74 Echo (ping) request  id=0x0200, seq=14080/55, ttl=32
    5   2.690268 192.168.10.101 → 192.168.10.127 ICMP 74 Echo (ping) reply    id=0x0200, seq=14080/55, ttl=128 (request in 4)
    6   2.690737 192.168.10.127 → 192.168.10.101 TCP 62 1196 → 445 [SYN] Seq=0 Win=64240 Len=0 MSS=1460 SACK_PERM=1
    7   2.690831 192.168.10.101 → 192.168.10.127 TCP 62 445 → 1196 [SYN, ACK] Seq=0 Ack=1 Win=64240 Len=0 MSS=1460 SACK_PERM=1
    8   2.690972 192.168.10.127 → 192.168.10.101 TCP 60 1196 → 445 [ACK] Seq=1 Ack=1 Win=64240 Len=0
    9   2.691291 192.168.10.127 → 192.168.10.101 ICMP 74 Echo (ping) request  id=0x0200, seq=14336/56, ttl=32
   10   2.691382 192.168.10.101 → 192.168.10.127 ICMP 74 Echo (ping) reply    id=0x0200, seq=14336/56, ttl=128 (request in 9)
   11   2.691736 192.168.10.127 → 192.168.10.101 SMB 191 Negotiate Protocol Request
   12   2.692079 192.168.10.101 → 192.168.10.127 SMB 234 Negotiate Protocol Response
   13   2.693451 192.168.10.127 → 192.168.10.101 TCP 1514 Session message [TCP segment of a reassembled PDU]
   14   2.693546 192.168.10.127 → 192.168.10.101 SMB 1182 Session Setup AndX Request
   15   2.693642 192.168.10.101 → 192.168.10.127 TCP 60 445 → 1196 [ACK] Seq=181 Ack=2726 Win=64240 Len=0
   16   2.694946 192.168.10.101 → 192.168.10.127 SMB 403 Session Setup AndX Response
   17   2.695572 192.168.10.127 → 192.168.10.101 SMB 160 Tree Connect AndX Request, Path: \\SKYNET.EXAMPLE.COM\IPC$
   18   2.695772 192.168.10.101 → 192.168.10.127 SMB 114 Tree Connect AndX Response
   19   2.696179 192.168.10.127 → 192.168.10.101 SMB 130 Trans2 Request, GET_DFS_REFERRAL, File: 
   20   2.696495 192.168.10.101 → 192.168.10.127 SMB 234 Trans2 Response, GET_DFS_REFERRAL
   21   2.700284 192.168.10.127 → 192.168.10.101 SMB 154 Trans2 Request, GET_DFS_REFERRAL, File: \example.com
   22   2.700652 192.168.10.101 → 192.168.10.127 SMB 222 Trans2 Response, GET_DFS_REFERRAL
   23   2.701036 192.168.10.127 → 192.168.10.101 SMB 146 Trans2 Request, GET_DFS_REFERRAL, File: \EXAMPLE
   24   2.701274 192.168.10.101 → 192.168.10.127 SMB 190 Trans2 Response, GET_DFS_REFERRAL
   25   2.887419 192.168.10.127 → 192.168.10.101 TCP 60 1196 → 445 [ACK] Seq=3100 Ack=1074 Win=63167 Len=0
   26  12.669128 192.168.10.120 → 255.255.255.255 ENIP 194 53533 → 2222 Len=152[Malformed Packet]
   27  14.058073 192.168.10.127 → 192.168.10.101 SMB 97 Logoff AndX Request
   28  14.058804 192.168.10.101 → 192.168.10.127 SMB 97 Logoff AndX Response
   29  14.059105 192.168.10.127 → 192.168.10.101 SMB 93 Tree Disconnect Request
   30  14.059244 192.168.10.101 → 192.168.10.127 SMB 93 Tree Disconnect Response
   31  14.059895 192.168.10.127 → 192.168.10.101 TCP 60 1196 → 445 [FIN, ACK] Seq=3182 Ack=1156 Win=63085 Len=0
   32  14.059994 192.168.10.101 → 192.168.10.127 TCP 60 445 → 1196 [FIN, ACK] Seq=1156 Ack=3183 Win=63784 Len=0
   33  14.060099 192.168.10.127 → 192.168.10.101 TCP 60 1196 → 445 [ACK] Seq=3183 Ack=1157 Win=63085 Len=0
   34  22.218498 192.168.10.128 → 192.168.10.101 DNS 70 Standard query 0x0623 A google.com
   35  22.218889 Vmware_28:c0:55 → Broadcast    ARP 60 Who has 192.168.10.100? Tell 192.168.10.101
   36  22.219301 Cisco-Li_f7:3e:d2 → Vmware_28:c0:55 ARP 60 192.168.10.100 is at 00:18:39:f7:3e:d2
   37  22.219424 192.168.10.101 → 216.239.34.10 DNS 70 Standard query 0x2d00 A google.com
   38  22.723260 216.239.34.10 → 192.168.10.101 DNS 254 Standard query response 0x2d00 A google.com A 74.125.45.100 A 209.85.171.100 A 74.125.67.100 NS ns3.google.com NS ns2.google.com NS ns4.google.com NS ns1.google.com A 216.239.32.10 A 216.239.34.10 A 216.239.36.10 A 216.239.38.10
   39  22.723581 Vmware_28:c0:55 → Broadcast    ARP 60 Who has 192.168.10.128? Tell 192.168.10.101
   40  22.723984 Vmware_9c:aa:25 → Vmware_28:c0:55 ARP 60 192.168.10.128 is at 00:0c:29:9c:aa:25
   41  22.724091 192.168.10.101 → 192.168.10.128 DNS 254 Standard query response 0x0623 A google.com A 74.125.45.100 A 209.85.171.100 A 74.125.67.100 NS ns3.google.com NS ns2.google.com NS ns4.google.com NS ns1.google.com A 216.239.32.10 A 216.239.34.10 A 216.239.36.10 A 216.239.38.10
   42  22.725147 192.168.10.128 → 74.125.45.100 TCP 62 1295 → 80 [SYN] Seq=0 Win=64240 Len=0 MSS=1460 SACK_PERM=1
   43  22.861886 74.125.45.100 → 192.168.10.128 TCP 62 80 → 1295 [SYN, ACK] Seq=0 Ack=1 Win=5720 Len=0 MSS=1380 SACK_PERM=1
   44  22.862071 192.168.10.128 → 74.125.45.100 TCP 60 1295 → 80 [ACK] Seq=1 Ack=1 Win=64860 Len=0
   45  22.862363 192.168.10.128 → 74.125.45.100 HTTP 336 GET / HTTP/1.1 
   46  22.999588 74.125.45.100 → 192.168.10.128 TCP 60 80 → 1295 [ACK] Seq=1 Ack=283 Win=6432 Len=0
   47  23.011564 74.125.45.100 → 192.168.10.128 HTTP 532 HTTP/1.1 301 Moved Permanently  (text/html)
   48  23.013467 192.168.10.128 → 192.168.10.101 DNS 74 Standard query 0xb020 A www.google.com
   49  23.013902 192.168.10.101 → 72.14.235.9  DNS 76 Standard query 0x3d08 A www.l.google.com
   50  23.128889 192.168.10.128 → 74.125.45.100 TCP 60 1295 → 80 [ACK] Seq=283 Ack=479 Win=64382 Len=0
   51  23.321225  72.14.235.9 → 192.168.10.101 DNS 140 Standard query response 0x3d08 A www.l.google.com A 74.125.19.103 A 74.125.19.104 A 74.125.19.147 A 74.125.19.99
   52  23.321566 192.168.10.101 → 192.168.10.128 DNS 158 Standard query response 0xb020 A www.google.com CNAME www.l.google.com A 74.125.19.103 A 74.125.19.104 A 74.125.19.147 A 74.125.19.99
   53  23.322510 192.168.10.128 → 74.125.19.103 TCP 62 1296 → 80 [SYN] Seq=0 Win=64240 Len=0 MSS=1460 SACK_PERM=1
   54  23.495865 74.125.19.103 → 192.168.10.128 TCP 62 80 → 1296 [SYN, ACK] Seq=0 Ack=1 Win=5720 Len=0 MSS=1380 SACK_PERM=1
   55  23.496089 192.168.10.128 → 74.125.19.103 TCP 60 1296 → 80 [ACK] Seq=1 Ack=1 Win=64860 Len=0
   56  23.496343 192.168.10.128 → 74.125.19.103 HTTP 340 GET / HTTP/1.1 
   57  23.680637 74.125.19.103 → 192.168.10.128 TCP 60 80 → 1296 [ACK] Seq=1 Ack=287 Win=6432 Len=0
   58  23.698127 74.125.19.103 → 192.168.10.128 TCP 409 HTTP/1.1 200 OK  [TCP segment of a reassembled PDU]
   59  23.704733 74.125.19.103 → 192.168.10.128 TCP 1434 80 → 1296 [ACK] Seq=356 Ack=287 Win=6432 Len=1380 [TCP segment of a reassembled PDU]
   60  23.704906 192.168.10.128 → 74.125.19.103 TCP 60 1296 → 80 [ACK] Seq=287 Ack=1736 Win=64860 Len=0
   61  23.721729 74.125.19.103 → 192.168.10.128 HTTP 1416 HTTP/1.1 200 OK  (text/html)
   62  23.810950 192.168.10.128 → 74.125.19.103 HTTP 397 GET /intl/en_ALL/images/logo.gif HTTP/1.1 
   63  23.848128 192.168.10.128 → 74.125.19.103 TCP 62 1297 → 80 [SYN] Seq=0 Win=64240 Len=0 MSS=1460 SACK_PERM=1
   64  23.998136 74.125.19.103 → 192.168.10.128 TCP 287 HTTP/1.1 200 OK  [TCP segment of a reassembled PDU]
   65  24.004676 74.125.19.103 → 192.168.10.128 TCP 1434 80 → 1296 [ACK] Seq=3331 Ack=630 Win=7504 Len=1380 [TCP segment of a reassembled PDU]
   66  24.004928 192.168.10.128 → 74.125.19.103 TCP 60 1296 → 80 [ACK] Seq=630 Ack=4711 Win=64860 Len=0
   67  24.021689 74.125.19.103 → 192.168.10.128 TCP 1434 80 → 1296 [ACK] Seq=4711 Ack=630 Win=7504 Len=1380 [TCP segment of a reassembled PDU]
   68  24.032766 74.125.19.103 → 192.168.10.128 TCP 62 80 → 1297 [SYN, ACK] Seq=0 Ack=1 Win=5720 Len=0 MSS=1380 SACK_PERM=1
   69  24.032940 192.168.10.128 → 74.125.19.103 TCP 60 1297 → 80 [ACK] Seq=1 Ack=1 Win=64860 Len=0
   70  24.033301 192.168.10.128 → 74.125.19.103 HTTP 467 GET /extern_js/f/CgJlbhICdXMrMAo4DSwrMA44BCwrMBY4BCwrMBc4ASwrMBg4AywrMCU4yYgBLCswJzgALA/O3Bglj0MzBQ.js HTTP/1.1 
   71  24.038687 74.125.19.103 → 192.168.10.128 TCP 1390 80 → 1296 [PSH, ACK] Seq=6091 Ack=630 Win=7504 Len=1336 [TCP segment of a reassembled PDU]
   72  24.038838 192.168.10.128 → 74.125.19.103 TCP 60 1296 → 80 [ACK] Seq=630 Ack=7427 Win=64860 Len=0
   73  24.185611 74.125.19.103 → 192.168.10.128 TCP 1434 80 → 1296 [ACK] Seq=7427 Ack=630 Win=7504 Len=1380 [TCP segment of a reassembled PDU]
   74  24.191946 74.125.19.103 → 192.168.10.128 TCP 1434 80 → 1296 [ACK] Seq=8807 Ack=630 Win=7504 Len=1380 [TCP segment of a reassembled PDU]
   75  24.192127 192.168.10.128 → 74.125.19.103 TCP 60 1296 → 80 [ACK] Seq=630 Ack=10187 Win=64860 Len=0
   76  24.208957 74.125.19.103 → 192.168.10.128 TCP 1434 80 → 1296 [ACK] Seq=10187 Ack=630 Win=7504 Len=1380 [TCP segment of a reassembled PDU]
   77  24.220443 74.125.19.103 → 192.168.10.128 TCP 60 80 → 1297 [ACK] Seq=1 Ack=414 Win=6432 Len=0
   78  24.221170 74.125.19.103 → 192.168.10.128 HTTP 376 HTTP/1.1 200 OK  (GIF89a)
   79  24.221305 192.168.10.128 → 74.125.19.103 TCP 60 1296 → 80 [ACK] Seq=630 Ack=11889 Win=64860 Len=0
   80  24.233664 74.125.19.103 → 192.168.10.128 TCP 325 HTTP/1.1 200 OK  [TCP segment of a reassembled PDU]
   81  24.236610 192.168.10.128 → 74.125.19.103 HTTP 390 GET /images/nav_logo3.png HTTP/1.1 
   82  24.240311 74.125.19.103 → 192.168.10.128 TCP 1434 80 → 1297 [ACK] Seq=272 Ack=414 Win=6432 Len=1380 [TCP segment of a reassembled PDU]
   83  24.240506 192.168.10.128 → 74.125.19.103 TCP 60 1297 → 80 [ACK] Seq=414 Ack=1652 Win=64860 Len=0
   84  24.259388 74.125.19.103 → 192.168.10.128 TCP 1434 80 → 1297 [ACK] Seq=1652 Ack=414 Win=6432 Len=1380 [TCP segment of a reassembled PDU]
   85  24.274284 74.125.19.103 → 192.168.10.128 TCP 1390 80 → 1297 [PSH, ACK] Seq=3032 Ack=414 Win=6432 Len=1336 [TCP segment of a reassembled PDU]
   86  24.274479 192.168.10.128 → 74.125.19.103 TCP 60 1297 → 80 [ACK] Seq=414 Ack=4368 Win=64860 Len=0
   87  24.426304 74.125.19.103 → 192.168.10.128 TCP 288 HTTP/1.1 200 OK  [TCP segment of a reassembled PDU]
   88  24.431171 74.125.19.103 → 192.168.10.128 HTTP 1058 HTTP/1.1 200 OK  (text/javascript)
   89  24.437305 74.125.19.103 → 192.168.10.128 TCP 1434 80 → 1296 [ACK] Seq=12123 Ack=966 Win=8576 Len=1380 [TCP segment of a reassembled PDU]
   90  24.437309 192.168.10.128 → 74.125.19.103 TCP 60 1296 → 80 [RST, ACK] Seq=966 Ack=12123 Win=0 Len=0
   91  24.437721 192.168.10.128 → 74.125.19.103 TCP 60 1296 → 80 [RST] Seq=966 Win=0 Len=0
   92  24.456098 192.168.10.128 → 192.168.10.101 DNS 79 Standard query 0xd92e A clients1.google.com
   93  24.456481 192.168.10.101 → 216.239.34.10 DNS 79 Standard query 0x1514 A clients1.google.com
   94  24.520598 216.239.34.10 → 192.168.10.101 DNS 327 Standard query response 0x1514 A clients1.google.com CNAME clients.l.google.com NS e.l.google.com NS b.l.google.com NS c.l.google.com NS a.l.google.com NS g.l.google.com NS f.l.google.com NS d.l.google.com A 209.85.139.9 A 74.125.45.9 A 64.233.161.9 A 74.125.77.9 A 209.85.137.9 A 72.14.235.9 A 74.125.95.9
   95  24.520895 192.168.10.101 → 74.125.77.9  DNS 80 Standard query 0x1d1e A clients.l.google.com
   96  24.537128 192.168.10.128 → 74.125.19.103 TCP 60 1297 → 80 [ACK] Seq=414 Ack=5372 Win=63856 Len=0
   97  24.582742  74.125.77.9 → 192.168.10.101 DNS 144 Standard query response 0x1d1e A clients.l.google.com A 74.125.19.113 A 74.125.19.102 A 74.125.19.100 A 74.125.19.101
   98  24.582974 192.168.10.101 → 192.168.10.128 DNS 167 Standard query response 0xd92e A clients1.google.com CNAME clients.l.google.com A 74.125.19.113 A 74.125.19.102 A 74.125.19.100 A 74.125.19.101
   99  24.583768 192.168.10.128 → 74.125.19.113 TCP 62 1298 → 80 [SYN] Seq=0 Win=64240 Len=0 MSS=1460 SACK_PERM=1
  100  24.762754 74.125.19.113 → 192.168.10.128 TCP 62 80 → 1298 [SYN, ACK] Seq=0 Ack=1 Win=5720 Len=0 MSS=1380 SACK_PERM=1
  101  24.762955 192.168.10.128 → 74.125.19.113 TCP 60 1298 → 80 [ACK] Seq=1 Ack=1 Win=64860 Len=0
  102  24.763310 192.168.10.128 → 74.125.19.113 HTTP 387 GET /generate_204 HTTP/1.1 
  103  24.947496 74.125.19.113 → 192.168.10.128 TCP 60 80 → 1298 [ACK] Seq=1 Ack=334 Win=6432 Len=0
  104  24.952911 74.125.19.113 → 192.168.10.128 HTTP 137 HTTP/1.1 204 No Content 
  105  25.140599 192.168.10.128 → 74.125.19.113 TCP 60 1298 → 80 [ACK] Seq=334 Ack=84 Win=64777 Len=0
  106  25.379302 192.168.10.128 → 74.125.19.113 HTTP 407 GET /complete/search?hl=en&gl=us&q=bn HTTP/1.1 
  107  25.534215 192.168.10.128 → 74.125.19.113 TCP 62 1299 → 80 [SYN] Seq=0 Win=64240 Len=0 MSS=1460 SACK_PERM=1
  108  25.583596 74.125.19.113 → 192.168.10.128 TCP 310 HTTP/1.1 200 OK  [TCP segment of a reassembled PDU]
  109  25.588705 74.125.19.113 → 192.168.10.128 HTTP 227 HTTP/1.1 200 OK  (text/javascript)
  110  25.588893 192.168.10.128 → 74.125.19.113 TCP 60 1298 → 80 [ACK] Seq=687 Ack=513 Win=64348 Len=0
  111  25.719676 74.125.19.113 → 192.168.10.128 TCP 62 80 → 1299 [SYN, ACK] Seq=0 Ack=1 Win=5720 Len=0 MSS=1380 SACK_PERM=1
  112  25.719849 192.168.10.128 → 74.125.19.113 TCP 60 1299 → 80 [ACK] Seq=1 Ack=1 Win=64860 Len=0
  113  25.720146 192.168.10.128 → 74.125.19.113 HTTP 408 GET /complete/search?hl=en&gl=us&q=bni HTTP/1.1 
  114  25.915430 74.125.19.113 → 192.168.10.128 TCP 60 80 → 1299 [ACK] Seq=1 Ack=355 Win=6432 Len=0
  115  25.932551 74.125.19.113 → 192.168.10.128 TCP 310 HTTP/1.1 200 OK  [TCP segment of a reassembled PDU]
  116  25.933384 74.125.19.113 → 192.168.10.128 HTTP 240 HTTP/1.1 200 OK  (text/javascript)
  117  25.933577 192.168.10.128 → 74.125.19.113 TCP 60 1299 → 80 [ACK] Seq=355 Ack=443 Win=64418 Len=0
  118  26.007405 192.168.10.128 → 74.125.19.113 HTTP 406 GET /complete/search?hl=en&gl=us&q=b HTTP/1.1 
  119  26.224781 74.125.19.113 → 192.168.10.128 TCP 310 HTTP/1.1 200 OK  [TCP segment of a reassembled PDU]
  120  26.225850 74.125.19.113 → 192.168.10.128 HTTP 274 HTTP/1.1 200 OK  (text/javascript)
  121  26.226071 192.168.10.128 → 74.125.19.113 TCP 60 1298 → 80 [ACK] Seq=1039 Ack=989 Win=63872 Len=0
  122  26.628190 192.168.10.128 → 74.125.19.113 HTTP 407 GET /complete/search?hl=en&gl=us&q=bi HTTP/1.1 
  123  26.783272 192.168.10.128 → 74.125.19.113 HTTP 408 GET /complete/search?hl=en&gl=us&q=bit HTTP/1.1 
  124  26.847237 74.125.19.113 → 192.168.10.128 TCP 310 HTTP/1.1 200 OK  [TCP segment of a reassembled PDU]
  125  26.848112 74.125.19.113 → 192.168.10.128 HTTP 256 HTTP/1.1 200 OK  (text/javascript)
  126  26.848286 192.168.10.128 → 74.125.19.113 TCP 60 1299 → 80 [ACK] Seq=708 Ack=901 Win=63960 Len=0
  127  26.994615 74.125.19.113 → 192.168.10.128 TCP 310 HTTP/1.1 200 OK  [TCP segment of a reassembled PDU]
  128  27.000898 74.125.19.113 → 192.168.10.128 HTTP 251 HTTP/1.1 200 OK  (text/javascript)
  129  27.001219 192.168.10.128 → 74.125.19.113 TCP 60 1298 → 80 [ACK] Seq=1393 Ack=1442 Win=64860 Len=0
  130  27.191533 192.168.10.128 → 74.125.19.113 HTTP 409 GET /complete/search?hl=en&gl=us&q=bitt HTTP/1.1 
  131  27.416092 74.125.19.113 → 192.168.10.128 TCP 310 HTTP/1.1 200 OK  [TCP segment of a reassembled PDU]
  132  27.422405 74.125.19.113 → 192.168.10.128 HTTP 260 HTTP/1.1 200 OK  (text/javascript)
  133  27.422590 192.168.10.128 → 74.125.19.113 TCP 60 1299 → 80 [ACK] Seq=1063 Ack=1363 Win=63498 Len=0
  134  27.441702 192.168.10.128 → 74.125.19.113 HTTP 411 GET /complete/search?hl=en&gl=us&q=bittor HTTP/1.1 
  135  27.652822 74.125.19.113 → 192.168.10.128 TCP 310 HTTP/1.1 200 OK  [TCP segment of a reassembled PDU]
  136  27.659141 74.125.19.113 → 192.168.10.128 HTTP 249 HTTP/1.1 200 OK  (text/javascript)
  137  27.659301 192.168.10.128 → 74.125.19.113 TCP 60 1298 → 80 [ACK] Seq=1750 Ack=1893 Win=64409 Len=0
  138  27.673618 192.168.10.100 → 239.255.255.250 SSDP 329 NOTIFY * HTTP/1.1 
  139  27.674048 192.168.10.100 → 239.255.255.250 SSDP 338 NOTIFY * HTTP/1.1 
  140  27.674110 192.168.10.100 → 239.255.255.250 SSDP 401 NOTIFY * HTTP/1.1 
  141  27.674159 192.168.10.100 → 239.255.255.250 SSDP 393 NOTIFY * HTTP/1.1 
  142  27.674195 192.168.10.100 → 239.255.255.250 SSDP 338 NOTIFY * HTTP/1.1 
  143  27.674252 192.168.10.100 → 239.255.255.250 SSDP 377 NOTIFY * HTTP/1.1 
  144  27.674307 192.168.10.100 → 239.255.255.250 SSDP 409 NOTIFY * HTTP/1.1 
  145  27.674342 192.168.10.100 → 239.255.255.250 SSDP 338 NOTIFY * HTTP/1.1 
  146  27.674402 192.168.10.100 → 239.255.255.250 SSDP 397 NOTIFY * HTTP/1.1 
  147  27.674454 192.168.10.100 → 239.255.255.250 SSDP 403 NOTIFY * HTTP/1.1 
  148  27.674498 192.168.10.100 → 239.255.255.250 SSDP 391 NOTIFY * HTTP/1.1 
  149  27.690915 192.168.10.128 → 74.125.19.113 HTTP 412 GET /complete/search?hl=en&gl=us&q=bittorr HTTP/1.1 
  150  27.900501 74.125.19.113 → 192.168.10.128 TCP 310 HTTP/1.1 200 OK  [TCP segment of a reassembled PDU]
  151  27.907126 74.125.19.113 → 192.168.10.128 HTTP 253 HTTP/1.1 200 OK  (text/javascript)
  152  27.907285 192.168.10.128 → 74.125.19.113 TCP 60 1299 → 80 [ACK] Seq=1421 Ack=1818 Win=64860 Len=0
  153  31.864050 192.168.10.128 → 74.125.19.113 HTTP 414 GET /complete/search?hl=en&gl=us&q=bittorren HTTP/1.1 
  154  32.065689 74.125.19.113 → 192.168.10.128 TCP 310 HTTP/1.1 200 OK  [TCP segment of a reassembled PDU]
  155  32.066722 74.125.19.113 → 192.168.10.128 HTTP 252 HTTP/1.1 200 OK  (text/javascript)
  156  32.066908 192.168.10.128 → 74.125.19.113 TCP 60 1298 → 80 [ACK] Seq=2110 Ack=2347 Win=63955 Len=0
  157  33.000385 74.125.45.100 → 192.168.10.128 TCP 60 80 → 1295 [FIN, ACK] Seq=479 Ack=283 Win=6432 Len=0
  158  33.000580 192.168.10.128 → 74.125.45.100 TCP 60 1295 → 80 [ACK] Seq=283 Ack=480 Win=64382 Len=0
  159  33.032182 192.168.10.128 → 74.125.19.103 HTTP 488 GET /search?hl=en&q=bittorrent&aq=f&oq= HTTP/1.1 
  160  33.108644 192.168.10.128 → 74.125.19.113 HTTP 415 GET /complete/search?hl=en&gl=us&q=bittorrent HTTP/1.1 
  161  33.247309 74.125.19.103 → 192.168.10.128 TCP 537 HTTP/1.1 200 OK  [TCP segment of a reassembled PDU]
  162  33.247759 192.168.10.128 → 74.125.45.100 TCP 60 1295 → 80 [RST, ACK] Seq=283 Ack=480 Win=0 Len=0
  163  33.254302 74.125.19.103 → 192.168.10.128 TCP 1434 HTTP/1.1 200 OK  [TCP segment of a reassembled PDU]
  164  33.254468 192.168.10.128 → 74.125.19.103 TCP 60 1297 → 80 [ACK] Seq=848 Ack=7235 Win=64860 Len=0
  165  33.266734 74.125.19.103 → 192.168.10.128 TCP 1434 HTTP/1.1 200 OK  [TCP segment of a reassembled PDU]
  166  33.269142 192.168.10.128 → 74.125.19.113 TCP 60 1299 → 80 [RST, ACK] Seq=1782 Ack=1818 Win=0 Len=0
  167  33.272466 74.125.19.103 → 192.168.10.128 TCP 185 HTTP/1.1 200 OK  [TCP segment of a reassembled PDU]
  168  33.272651 192.168.10.128 → 74.125.19.103 TCP 60 1297 → 80 [ACK] Seq=848 Ack=8746 Win=64860 Len=0
  169  33.279746 192.168.10.128 → 74.125.19.103 TCP 62 1300 → 80 [SYN] Seq=0 Win=64240 Len=0 MSS=1460 SACK_PERM=1
  170  33.328781 74.125.19.103 → 192.168.10.128 TCP 1434 HTTP/1.1 200 OK  [TCP segment of a reassembled PDU]
  171  33.436266 74.125.19.103 → 192.168.10.128 TCP 1434 HTTP/1.1 200 OK  [TCP segment of a reassembled PDU]
  172  33.436481 192.168.10.128 → 74.125.19.103 TCP 60 1297 → 80 [ACK] Seq=848 Ack=11506 Win=64860 Len=0
  173  33.442115 74.125.19.103 → 192.168.10.128 TCP 1434 HTTP/1.1 200 OK  [TCP segment of a reassembled PDU]
  174  33.447759 74.125.19.103 → 192.168.10.128 HTTP 106 HTTP/1.1 200 OK  (text/html)
  175  33.447950 192.168.10.128 → 74.125.19.103 TCP 60 1297 → 80 [ACK] Seq=848 Ack=12938 Win=64860 Len=0
  176  33.453633 192.168.10.128 → 74.125.19.103 HTTP 561 GET /images/newspaper.gif HTTP/1.1 
  177  33.454541 74.125.19.103 → 192.168.10.128 TCP 62 80 → 1300 [SYN, ACK] Seq=0 Ack=1 Win=5720 Len=0 MSS=1380 SACK_PERM=1
  178  33.454701 192.168.10.128 → 74.125.19.103 TCP 60 1300 → 80 [ACK] Seq=1 Ack=1 Win=64860 Len=0
  179  33.455001 192.168.10.128 → 74.125.19.103 HTTP 561 GET /images/nav_logo3.png HTTP/1.1 
  180  33.631389 74.125.19.103 → 192.168.10.128 TCP 289 HTTP/1.1 200 OK  [TCP segment of a reassembled PDU]
  181  33.632005 74.125.19.103 → 192.168.10.128 TCP 60 80 → 1300 [ACK] Seq=1 Ack=508 Win=6432 Len=0
  182  33.638240 74.125.19.103 → 192.168.10.128 TCP 1434 80 → 1297 [ACK] Seq=13173 Ack=1355 Win=8576 Len=1380 [TCP segment of a reassembled PDU]
  183  33.638418 192.168.10.128 → 74.125.19.103 TCP 60 1297 → 80 [ACK] Seq=1355 Ack=14553 Win=64860 Len=0
  184  33.638588 74.125.19.103 → 192.168.10.128 TCP 288 HTTP/1.1 200 OK  [TCP segment of a reassembled PDU]
  185  33.645244 74.125.19.103 → 192.168.10.128 TCP 1434 80 → 1300 [ACK] Seq=235 Ack=508 Win=6432 Len=1380 [TCP segment of a reassembled PDU]
  186  33.645435 192.168.10.128 → 74.125.19.103 TCP 60 1300 → 80 [ACK] Seq=508 Ack=1615 Win=64860 Len=0
  187  33.654956 74.125.19.103 → 192.168.10.128 HTTP 307 HTTP/1.1 200 OK  (GIF89a)
  188  33.657143 192.168.10.128 → 74.125.19.103 HTTP 646 GET /extern_js/f/CgJlbhICdXMrMAo4DSwrMA44BCwrMBY4BCwrMBc4ASwrMBg4AywrMCU4yYgBLCswJjgCLCswJzgALA/HqrQrDrW0aQ.js HTTP/1.1 
  189  33.661635 74.125.19.103 → 192.168.10.128 TCP 1434 80 → 1300 [ACK] Seq=1615 Ack=508 Win=6432 Len=1380 [TCP segment of a reassembled PDU]
  190  33.673086 74.125.19.103 → 192.168.10.128 TCP 1390 80 → 1300 [PSH, ACK] Seq=2995 Ack=508 Win=6432 Len=1336 [TCP segment of a reassembled PDU]
  191  33.673258 192.168.10.128 → 74.125.19.103 TCP 60 1300 → 80 [ACK] Seq=508 Ack=4331 Win=64860 Len=0
  192  33.834211 74.125.19.103 → 192.168.10.128 TCP 1434 80 → 1300 [ACK] Seq=4331 Ack=508 Win=6432 Len=1380 [TCP segment of a reassembled PDU]
  193  33.837444 74.125.19.103 → 192.168.10.128 HTTP 917 HTTP/1.1 200 OK  (PNG)
  194  33.837617 192.168.10.128 → 74.125.19.103 TCP 60 1300 → 80 [ACK] Seq=508 Ack=6574 Win=64860 Len=0
  195  33.861177 74.125.19.103 → 192.168.10.128 TCP 325 HTTP/1.1 200 OK  [TCP segment of a reassembled PDU]
  196  33.878868 74.125.19.103 → 192.168.10.128 TCP 1434 80 → 1297 [ACK] Seq=15077 Ack=1947 Win=10064 Len=1380 [TCP segment of a reassembled PDU]
  197  33.879030 192.168.10.128 → 74.125.19.103 TCP 60 1297 → 80 [ACK] Seq=1947 Ack=16457 Win=64860 Len=0
  198  33.895862 74.125.19.103 → 192.168.10.128 TCP 1434 80 → 1297 [ACK] Seq=16457 Ack=1947 Win=10064 Len=1380 [TCP segment of a reassembled PDU]
  199  33.907317 74.125.19.103 → 192.168.10.128 TCP 1390 80 → 1297 [PSH, ACK] Seq=17837 Ack=1947 Win=10064 Len=1336 [TCP segment of a reassembled PDU]
  200  33.907488 192.168.10.128 → 74.125.19.103 TCP 60 1297 → 80 [ACK] Seq=1947 Ack=19173 Win=64860 Len=0
  201  33.927578 74.125.19.103 → 192.168.10.128 HTTP 1380 HTTP/1.1 200 OK  (text/javascript)
  202  33.934494 192.168.10.128 → 74.125.19.103 HTTP 649 GET /csi?v=3&s=web&action=&tran=undefined&ei=jNW3SdiOApGYsAOpo930AQ&e=17259,18169,19897&rt=prt.187,ol.578,xjs.656 HTTP/1.1 
  203  34.092660 192.168.10.128 → 74.125.19.103 TCP 60 1297 → 80 [ACK] Seq=1947 Ack=20499 Win=63534 Len=0
  204  34.128703 74.125.19.103 → 192.168.10.128 HTTP 269 HTTP/1.1 204 No Content 
  205  34.294043 192.168.10.128 → 74.125.19.103 TCP 60 1300 → 80 [ACK] Seq=1103 Ack=6789 Win=64645 Len=0
  206  37.611681 192.168.10.128 → 74.125.19.103 HTTP 652 GET /url?sa=T&source=web&ct=res&cd=3&url=http%3A%2F%2Fen.wikipedia.org%2Fwiki%2FBitTorrent&ei=jNW3SdiOApGYsAOpo930AQ HTTP/1.1 
  207  37.653894 192.168.10.128 → 192.168.10.101 DNS 76 Standard query 0x2b2c A en.wikipedia.org
  208  37.654343 192.168.10.101 → 199.19.53.1  DNS 76 Standard query 0x0d24 A en.wikipedia.org
  209  37.707714  199.19.53.1 → 192.168.10.101 DNS 188 Standard query response 0x0d24 A en.wikipedia.org NS ns0.wikimedia.org NS ns1.wikimedia.org NS ns2.wikimedia.org A 208.80.152.130 A 203.212.189.252 A 91.198.174.4
  210  37.707970 192.168.10.101 → 203.212.189.252 DNS 76 Standard query 0x0d24 A en.wikipedia.org
  211  37.807667 74.125.19.103 → 192.168.10.128 HTTP 290 HTTP/1.1 204 No Content 
  212  37.914954 192.168.10.128 → 74.125.19.103 TCP 60 1297 → 80 [ACK] Seq=2545 Ack=20735 Win=64860 Len=0
  213  38.047863 203.212.189.252 → 192.168.10.101 DNS 142 Standard query response 0x0d24 A en.wikipedia.org CNAME rr.wikimedia.org CNAME rr.pmtpa.wikimedia.org A 208.80.152.2
  214  38.048503 192.168.10.101 → 199.249.112.1 DNS 76 Standard query 0x152d A rr.wikimedia.org
  215  38.089359 199.249.112.1 → 192.168.10.101 DNS 178 Standard query response 0x152d A rr.wikimedia.org NS ns0.wikimedia.org NS ns1.wikimedia.org NS ns2.wikimedia.org A 208.80.152.130 A 203.212.189.252 A 91.198.174.4
  216  38.089629 192.168.10.101 → 91.198.174.4 DNS 76 Standard query 0x152d A rr.wikimedia.org
  217  38.142173 91.198.174.4 → 192.168.10.101 DNS 115 Standard query response 0x152d A rr.wikimedia.org CNAME rr.pmtpa.wikimedia.org A 208.80.152.2
  218  38.142400 192.168.10.101 → 192.168.10.128 DNS 142 Standard query response 0x2b2c A en.wikipedia.org CNAME rr.wikimedia.org CNAME rr.pmtpa.wikimedia.org A 208.80.152.2
  219  38.143300 192.168.10.128 → 208.80.152.2 TCP 62 1301 → 80 [SYN] Seq=0 Win=64240 Len=0 MSS=1460 SACK_PERM=1
  220  38.288214 208.80.152.2 → 192.168.10.128 TCP 62 80 → 1301 [SYN, ACK] Seq=0 Ack=1 Win=5840 Len=0 MSS=1380 SACK_PERM=1
  221  38.288491 192.168.10.128 → 208.80.152.2 TCP 60 1301 → 80 [ACK] Seq=1 Ack=1 Win=64860 Len=0
  222  38.288809 192.168.10.128 → 208.80.152.2 HTTP 424 GET /wiki/BitTorrent HTTP/1.1 
  223  38.433784 208.80.152.2 → 192.168.10.128 TCP 60 80 → 1301 [ACK] Seq=1 Ack=371 Win=6432 Len=0
  224  38.438188 208.80.152.2 → 192.168.10.128 TCP 980 HTTP/1.0 200 OK  [TCP segment of a reassembled PDU]
  225  38.444232 208.80.152.2 → 192.168.10.128 TCP 1434 80 → 1301 [ACK] Seq=927 Ack=371 Win=6432 Len=1380 [TCP segment of a reassembled PDU]
  226  38.444413 192.168.10.128 → 208.80.152.2 TCP 60 1301 → 80 [ACK] Seq=371 Ack=2307 Win=64860 Len=0
  227  38.608550 208.80.152.2 → 192.168.10.128 TCP 1434 80 → 1301 [ACK] Seq=2307 Ack=371 Win=6432 Len=1380 [TCP segment of a reassembled PDU]
  228  38.612285 192.168.10.128 → 208.80.152.2 TCP 62 1302 → 80 [SYN] Seq=0 Win=64240 Len=0 MSS=1460 SACK_PERM=1
  229  38.613216 192.168.10.128 → 208.80.152.2 TCP 62 1303 → 80 [SYN] Seq=0 Win=64240 Len=0 MSS=1460 SACK_PERM=1
  230  38.614288 192.168.10.128 → 208.80.152.2 TCP 62 1304 → 80 [SYN] Seq=0 Win=64240 Len=0 MSS=1460 SACK_PERM=1
  231  38.617903 208.80.152.2 → 192.168.10.128 TCP 1434 80 → 1301 [ACK] Seq=3687 Ack=371 Win=6432 Len=1380 [TCP segment of a reassembled PDU]
  232  38.618164 192.168.10.128 → 208.80.152.2 TCP 60 1301 → 80 [ACK] Seq=371 Ack=5067 Win=64860 Len=0
  233  38.626241 208.80.152.2 → 192.168.10.128 TCP 1434 80 → 1301 [ACK] Seq=5067 Ack=371 Win=6432 Len=1380 [TCP segment of a reassembled PDU]
  234  38.755162 208.80.152.2 → 192.168.10.128 TCP 62 80 → 1302 [SYN, ACK] Seq=0 Ack=1 Win=5840 Len=0 MSS=1380 SACK_PERM=1
  235  38.755382 192.168.10.128 → 208.80.152.2 TCP 60 1302 → 80 [ACK] Seq=1 Ack=1 Win=64860 Len=0
  236  38.755705 192.168.10.128 → 208.80.152.2 HTTP 341 GET /skins-1.5/common/shared.css?206xx HTTP/1.1 
  237  38.761595 208.80.152.2 → 192.168.10.128 TCP 62 80 → 1304 [SYN, ACK] Seq=0 Ack=1 Win=5840 Len=0 MSS=1380 SACK_PERM=1
  238  38.761617 208.80.152.2 → 192.168.10.128 TCP 62 80 → 1303 [SYN, ACK] Seq=0 Ack=1 Win=5840 Len=0 MSS=1380 SACK_PERM=1
  239  38.761640 208.80.152.2 → 192.168.10.128 HTTP 112 HTTP/1.0 200 OK  (text/html)
  240  38.761767 192.168.10.128 → 208.80.152.2 TCP 60 1304 → 80 [ACK] Seq=1 Ack=1 Win=64860 Len=0
  241  38.761802 192.168.10.128 → 208.80.152.2 TCP 60 1303 → 80 [ACK] Seq=1 Ack=1 Win=64860 Len=0
  242  38.761844 192.168.10.128 → 208.80.152.2 TCP 60 1301 → 80 [ACK] Seq=371 Ack=6505 Win=64860 Len=0
  243  38.763548 192.168.10.128 → 208.80.152.2 HTTP 346 GET /skins-1.5/common/commonPrint.css?206xx HTTP/1.1 
  244  38.763797 192.168.10.128 → 208.80.152.2 HTTP 341 GET /skins-1.5/monobook/main.css?206xx HTTP/1.1 
  245  38.764103 192.168.10.128 → 208.80.152.2 HTTP 338 GET /skins-1.5/chick/main.css?206xx HTTP/1.1 
  246  38.907933 208.80.152.2 → 192.168.10.128 TCP 60 80 → 1302 [ACK] Seq=1 Ack=288 Win=6432 Len=0
  247  38.907965 208.80.152.2 → 192.168.10.128 TCP 60 80 → 1303 [ACK] Seq=1 Ack=293 Win=6432 Len=0
  248  38.907969 208.80.152.2 → 192.168.10.128 TCP 60 80 → 1304 [ACK] Seq=1 Ack=288 Win=6432 Len=0
  249  38.910689 208.80.152.2 → 192.168.10.128 TCP 648 HTTP/1.0 200 OK  [TCP segment of a reassembled PDU]
  250  38.913291 208.80.152.2 → 192.168.10.128 TCP 648 HTTP/1.0 200 OK  [TCP segment of a reassembled PDU]
  251  38.915915 208.80.152.2 → 192.168.10.128 TCP 648 HTTP/1.0 200 OK  [TCP segment of a reassembled PDU]
  252  38.918414 208.80.152.2 → 192.168.10.128 TCP 650 HTTP/1.0 200 OK  [TCP segment of a reassembled PDU]
  253  38.924698 208.80.152.2 → 192.168.10.128 TCP 1434 80 → 1301 [ACK] Seq=7099 Ack=655 Win=7504 Len=1380 [TCP segment of a reassembled PDU]
  254  38.924867 192.168.10.128 → 208.80.152.2 TCP 60 1301 → 80 [ACK] Seq=655 Ack=8479 Win=64860 Len=0
  255  38.930587 208.80.152.2 → 192.168.10.128 TCP 1434 80 → 1302 [ACK] Seq=595 Ack=288 Win=6432 Len=1380 [TCP segment of a reassembled PDU]
  256  38.930751 192.168.10.128 → 208.80.152.2 TCP 60 1302 → 80 [ACK] Seq=288 Ack=1975 Win=64860 Len=0
  257  38.936319 208.80.152.2 → 192.168.10.128 TCP 1434 80 → 1303 [ACK] Seq=595 Ack=293 Win=6432 Len=1380 [TCP segment of a reassembled PDU]
  258  38.936491 192.168.10.128 → 208.80.152.2 TCP 60 1303 → 80 [ACK] Seq=293 Ack=1975 Win=64860 Len=0
  259  38.942064 208.80.152.2 → 192.168.10.128 TCP 1434 80 → 1304 [ACK] Seq=597 Ack=288 Win=6432 Len=1380 [TCP segment of a reassembled PDU]
  260  38.942237 192.168.10.128 → 208.80.152.2 TCP 60 1304 → 80 [ACK] Seq=288 Ack=1977 Win=64860 Len=0
  261  38.953697 208.80.152.2 → 192.168.10.128 TCP 1434 80 → 1301 [ACK] Seq=8479 Ack=655 Win=7504 Len=1380 [TCP segment of a reassembled PDU]
  262  38.965207 208.80.152.2 → 192.168.10.128 TCP 1390 80 → 1301 [PSH, ACK] Seq=9859 Ack=655 Win=7504 Len=1336 [TCP segment of a reassembled PDU]
  263  38.965411 192.168.10.128 → 208.80.152.2 TCP 60 1301 → 80 [ACK] Seq=655 Ack=11195 Win=64860 Len=0
  264  39.082262 208.80.152.2 → 192.168.10.128 TCP 1434 80 → 1301 [ACK] Seq=11195 Ack=655 Win=7504 Len=1380 [TCP segment of a reassembled PDU]

 1975 -1236784491.068922              →              Ethernet 1485109633 [Packet size limited during capture]